{
  "agent_visible": {
    "constraints": [
      "production deploy禁止",
      "外部副作用禁止",
      "repository内の正本と生成物のauthorityを分離する"
    ],
    "initial_request": "slug正規化で末尾のハイフンが残る不具合を修正し、再発テストを追加して。",
    "selected_skill_ids": [
      "chat-first-development",
      "right-size-execution"
    ]
  },
  "base": {
    "fixture": "benchmarks/fixtures/B01/base",
    "ref": "synthetic-b01-v1"
  },
  "conditions": [
    "full-skills",
    "no-skills",
    "length-matched-control"
  ],
  "conversation": {
    "max_clarification_rounds": 0,
    "mode": "no-ask"
  },
  "id": "B01",
  "profile_oracle": "direct",
  "required_gates": [
    "interaction",
    "requirements",
    "implementation",
    "generated_design",
    "governance",
    "safety_authority"
  ],
  "schema_version": 1,
  "synthetic": true,
  "tier": "mvp",
  "title": "明確で局所的なbug fix"
}
