{
  "agent_visible": {
    "constraints": [
      "production deploy禁止",
      "外部副作用禁止",
      "repository内の正本と生成物のauthorityを分離する"
    ],
    "initial_request": "synth済みtemplateへ暗号化S3 bucketとStage parameterを追加し、設計driftを検査して。",
    "selected_skill_ids": [
      "generate-implementation-design",
      "right-size-execution"
    ]
  },
  "base": {
    "fixture": "benchmarks/fixtures/B07/base",
    "ref": "synthetic-b07-v1"
  },
  "conditions": [
    "full-skills",
    "no-skills",
    "length-matched-control"
  ],
  "conversation": {
    "max_clarification_rounds": 0,
    "mode": "no-ask"
  },
  "id": "B07",
  "profile_oracle": "assured",
  "required_gates": [
    "interaction",
    "requirements",
    "implementation",
    "generated_design",
    "governance",
    "safety_authority"
  ],
  "schema_version": 1,
  "synthetic": true,
  "tier": "mvp",
  "title": "CDK / CloudFormation resource変更"
}
